"One of the worst movie I have seen in 2009 so far: The story hesitates between a silly thriller or a dumb comedy.<br /><br />As nothings happens, the void is filled with long, boring dialogs that don't make any sense! <br /><br />The cast is famous but doesn't bring any emotions except to fast-forward the play! <br /><br />And it happens in a plush seaside hotel that looks really gloomy. In comparison, the one of the ""Shining"" is funfair! <br /><br />NB: a lot of users think that it is located in the French Riviera! They are wrong! It isn't the south of France (Nice, Cannes) but totally the opposite: Cabourg & Normandy, to be simple the beaches of the D-Day! That's why the sea is as grey as the sky and there isn't sun!,negative"
"Going into see Seven Pounds i wasn't clearly sure what to think because the previews left to much open to grasp what the movie was really about. So within the first 20 min or so you are completely lost in the plot, have no idea what is going on and you think Tim, who claims to be Ben, is just a big asshole. All of this comes to an end when the ""twist"",so to speak, is unraveled at the very last minute of the movie. Basically Tim (will smith) was troubled and haunted by a big accident he made causing the end of seven peoples lives. By this he decides to scope out seven new people who are in need of help badly who he in turns gives his life to.<br /><br />The acting of this film is great, as i feel will smith no matter what part he seems to impress. Rosario Dawson, to me, this is one of her better movies, aside from eagle eye which i think is up there to. She has been in some bad some good but she does deliver in this film. Other actors, such as woody Harrelson, have very small roles and not a big enough role to grasp the character. Although the casting of the film was still good.<br /><br />This movie was definitely not what i expected and certainly a lot slower pace in which i hoped. The movie, however, was still pretty good. Nothing is revealed until the last 5 min of the movie and everything falls into place. Up until then it just seems like a pointless love story. Final thought seven pounds=seven Stars.,positive"
I was at the same screenwriters conference and saw the movie. I thought the writer - Sue Smith - very clearly summarised what the film was about. However, the movie really didn't need explanation. I thought the themes were abundantly clear, and inspiring. A movie which deals with the the ability to dare, to face fear - especially fear passed down from parental figures - and overcome it and, in doing so, embrace life's possibilities, is a film to be treasured and savoured. I enjoyed it much more than the much-hyped 'Somersault.' I also think Mandy62 was a bit unkind to Hugo Weaving. As a bloke about his vintage, I should look so good! I agree that many Australian films have been lacklustre recently, but 'Peaches' delivers the goods. I'm glad I saw it.,positive
This movie is terrible. Carlitos Way(1993) is a great film. Goodgfellas it isn't but its one of the better crime films done. This movie should be considered closer to THE STING Part2 or maybe speed Zone. Remember those gems! The only reason this movie was made was to capitalize on the cult following of the original. This movie lacked everything De Palma, Pacino and Penn worked so hard on. There wasn't a likable character and that is the fault of everyone responsible for making it. I hope RISE TO POWER wins every RAZZIE it possibly can and maybe even invent some new categories to allow it be a record holder. After I watched this S@*T FEST movie, I sat down and watched the original Carlitos way to get th bad taste out of my mouth. After watching this I wish Pachanga came and whacked me out of my misery.,negative
"In addition to the fact that this is just an abysmally made film (imagine giving a camcorder to the average high school drama club) the people who think that there is anything ""real"" about this legend need to grow up. This is the 21st century. Guess what: ghosts don't exist. Most people learn that from their mother when they're about 5 years old. You guys seriously need to grow up.<br /><br />The fact that a fraud was perpetrated nearly 2 centuries ago does not make it any less a fraud. The fact that a large number of inbred hillbillies from Tennessee believe it doesn't do it either. Go to college. Or at least finish high school.,negative"
Dr. Bock teaches at the hospital and he is quite good at it. The thing about him is that he is depressed. Dr. Bock and his wife separated, his children are deviant, he cannot perform in the bedroom and he feels as if he isn't doing a very good job at healing people. He becomes suicidal but meets Barbara who changes his ideas for the better. All around this story is a murder mystery and a group of angry protesters outside.<br /><br />The movie is well done and the character of Dr. Bock is well played out. It's a little sad, somewhat funny and somewhat of a drama. It was good to see a couple stories wrapped around the hospital even if they were somewhat unrelated to what Dr. Bock was doing. Great movie.,positive
"I strongly dislike this show. I mean, like, basically everyone at that school is perfect, and rich, and I doubt a boarding school would look as cool as that. And why do they suddenly allow girls into the school? Isn't that just a little weird? anyways, Jamie Lynn spears CANNOT act. She always has the same facial expression, which really annoys me. She is basically emotionless, and all the guys seem to like her.<br /><br />and shouldn't chase tell her he likes her? its not that hard! really! None of this show is real life, and she isn't ""a girl like me"" because majority of the regular girls do NOT go to boarding school, do not have designer clothes, and do NOT live by the beach.<br /><br />fake fake fake.,negative"
"This movie is silly and very short of being a funny movie. Unhappy 'easterners' are not pleased with being out west; so they hire a drunk wagon master(John Candy)to lead them back east. Sight gags were just not funny enough to carry this one. And Richard Lewis gets on your nerves very quickly; but then I honestly don't like him at anything he does. Ed Lauter is hilarious as the bumbling villain.<br /><br />The movie was dedicated to Candy. He died from a massive heart attack ten days before the movie was completed. A stand in and digital enhancement enabled Candy's character to be seen in the final scenes. Candy was a very good comedian and gave us some real good knee slapping, belly laughs in his career. This movie was just not the caliber of his best.<br /><br />Also in the film, you will recognize: William Sanderson, Gailard Sartain, Ethan Phillips, Ellen Greene and Rodney A. Grant.,negative"
Annie Rooney lives with her officer father and brother Tim in the slums of New York, where she is constantly getting involved in many fights with the other neighborhood kids. Annie secretly has a crush on Joe Kelly (whose little brother Mickey is head of the gang that Annie constantly battles), who is in a gang that is headed for trouble, says Officer Rooney. Kelly sponsors a dance, where Tony plans to shoot Kelly in order to get even with him for making him look like a fool in front of his girl, but Officer Kelly gets fatally wounded instead. Tim (part of Kelly's gang) is told by Tony, and friend Spider, that Kelly shot his father, so he goes after him in vengeance. Annie learns of this and goes to stop her brother, if she is in time. Very good mix of humor and heart in this film, even though the plot doesn't start until the 40 minute mark of the film. Pickford is enjoyable (even though she was 33 playing a girl no more than 12-13) and really gets into her character. Haines doesn't play Kelly as tough as he should, but is able make the audience feel for him on an emotional level. The scenes where the officer tells Annie of her father's death and the ending really put a lump in your throat. The mix of all sorts of kids throughout the film are fun to watch. Rating, 8.,positive
If you like bad movies (and you must to watch this one) here's a good one. Not quite as funny as the first, but much lower quality. A must-see for fans of Jack Frost as well as anyone up for a good laugh at the writing.,negative
Prior to Airport 79' these movies were rather good. They had decent special effects, all-star cast, and good acting. This movie destroyed the franchise, and there are many reasons for it. Lets talk about the special effects WOW!!!! they are horrific, what was the director thinking about. I know it's only 1979, but lets look at other very good special effects movies such as Star Wars(1977),and Moonraker(1979). I like the idea of the Concord and this could of been the best Airport movie, but they did too much with it. How about Joe Patroni(George Kennedey) shooting a flare out of the cockpit window, to prevent a heat seeking missile from hitting the concord. Also he is doing 90 degree dives and loops. This completely far fetched, and unrealistic WOW!!!!!! Believe me the special effects don't help this scene, and really are beyond poor.... They almost look like a cartoon, and this is how the whole movie is!!!Finally lets talk about the acting which in my opinion is extremely poor to fair at best.... Over acting is a major issue in this movie, especially George Kennedy.. Which I really like as an actor, but just doesn't cut in this movie. The full blame has to go on the director, who did a very poor editing job, and really whacked out the Airport Franchise. Too bad the Concord isn't still used today it was a marvel of Air travel...,negative
"Even if you could get past the idea that these boring characters personally witnessed every Significant Moment of the 1960s (ok, so Katie didn't join the Manson Family, and nobody died at Altamont), this movie was still unbelievably awful. I got the impression that the ""writers"" just locked themselves in a room and watched ""Forrest Gump,"" ""The Wonder Years,"" and Oliver Stone's 60s films over and over again and called it research. A Canadian television critic called the conclusion of the first episode ""head spinning"". He was right.,negative"
It seems like more consideration has gone into the IMDb reviews of this film than went into the source.<br /><br />Here's a review without pretensions:<br /><br />Just when you think nothing is going to happen, it doesn't.<br /><br />Dress it up any way you like, this is a dull film, full of unengaging characters doing very little of interest.<br /><br />One to put on if you want to convince an impressionable emo chick that you're like, so deep, man.<br /><br />Not something to watch for your own pleasure though.<br /><br />Unless.<br /><br />You're.<br /><br />Pretentious.,negative
"As a fan of Henriksen (I liked him in the ""Millennium"" series) and of course Lorenzo ""Renegade"" Lamas, I had expected at least SOMETHING from this film. Sadly, the plot is predictable, the acting is bad and the computergraphics used for most stunts don't work out. Sometimes it even looks like they've captured some shots from Microsoft Flight Simulator.<br /><br />The cinematography sucks as well. Unnecessary funky camerawork in the beginning only detracts (from the cheesy dialogue) and gives the film a cheap, made-for-video-look. It works in hiphop-movies and Jet Li movies, but seems out of place in this flick.<br /><br />I would have liked this film 10 years ago. I was 11 then.,negative"
"This is my first Deepa Mehta film. I saw the film on TV in its Hindi version with its ""Sita"" character presented as Nita. I also note that it is Radha who underwent the allegorical trial by fire in the film and not Nita/Sita. Yet what I loved about the film was its screenplay by Ms Mehta, not her direction. The characters, big and small, were well-developed and seemed quixotic towards the end--somewhat like the end of Mazursky's ""An Unmarried Woman."" They are brave women surrounded by cardboard men. And one cardboard man (Ashok) seems to come alive in the last shot we see of him---carrying his invalid mother Biji. He seems to finally take on a future responsibility beyond celibacy and adherance to religion. <br /><br />Ms Mehta seems to fumble as a director (however, compared to most Indian mainstream cinema she would seem to be brilliant) as she cannot use her script to go beyond the microscopic joint family she is presenting except presenting a glimpse of the Chinese micro-minority in the social milieu of India. She even dedicates the film to her mother and daughter (not her father!) Yet her Radha reminesces of halcyon days with both her parents in a mustard field. Compare her to Mrinal Sen, Adoor Gopalakrishnan, Muzaffar Ali and she is dwarfed by these giants--given her competent Canadian production team and financial resources! Mehta's film of two bisexual ladies in an Indian middle-class household may be sacrilege to some, but merely captures the atrophy of middle-class homes that does not seem to aspire for something better than its immediate survival in a limited social space. Kannada, Malayalam, and Bengali films have touched parallel themes in India but did not have the publicity that surrounded this film and therefore have not been seen by a wide segment of knowledgeable cinemagoers.<br /><br />Ms Das, Ms Azmi, Mr Jafri and Mr Kharbanda are credible but not outstanding. Ms Azmi is a talented actress who gave superb performances under good directors (Mrinal Sen's ""Khandar"", Gautam Ghose's ""Paar"", Benegal's ""Ankur"") a brilliance notably absent in this film. Ms Das sparkled due to her screen presence rather than her acting capability. All in all, the film's strength remains in the structure of the screenplay which is above average in terms of international cinema. I am sure Ms Mehta can hone her writing talents in her future screenplays.,positive"
Louis Khan was one of the most influential architects of our time, and this film speaks volumes about how little everyone really knew. His son's desire to find out who, and more importantly what he was is moving, and emotional.<br /><br />This film captures the spirit of what architecture is really about, what good design is, and the emotional price that is paid for it. Equally haunting is the sound track. If you see the film, and then listen to the sound track you can revisit the film simply by listening. As a practicing architect of over 30 years, my heart ached and rejoiced over the film and its very straight forward, albeit emotional honesty and sincerity.<br /><br />I had the honor of seeing this film previewed in Chicago at the National Convention of the American Institute of Architects. The film was introduced by Daniel, and he was kind enough to do a question and answer session afterward. During the entire presentation of the film, not a sound, not a cough, not one distraction took place. The entire audience sat mesmerized, and the real treat, was Daniel's mother was present during the showing of the film.<br /><br />I will always remember the film, and play it over constantly in my mind every time I listen to the soundtrack...,positive
"It is unusual to see a film where the performance of a single actor is so good that one can feel that the film would be of little interest, if any, without his presence.<br /><br />Despite a not outstanding direction - in fact, there are many scenes that seem to have been shooted too quickly and carelessly -, a seemingly low budget, a strange plot about a man who wants to take the place of a defrocked priest and another week points, the presence of Pierre Fresnay is so impressive that one gets shocked from the very begining to the terrible end.<br /><br />I have never seen nor can iomagine for future a better performance, even Paul Scofield acting in ""A man for all seasons"".<br /><br />Actually the end could be considered even ridiculous if Fresnay were not playing the transtorned priest who returns to Church by performing a crime.<br /><br />""Je suis Maurice Morand, prètre catholique"" (""I am Maurice Morand, a catholic priest"")is said with such a brilliancy that one may forget the madness that conducted to that end.<br /><br />The other impressive thing this film has is a single scene in wich Morand - who despite being a defrocked one is stil a priest - consacrates in a cabaret a huge amount of vine turning it into Christ´s blood.<br /><br />Gérard - the man that wants to return Morand to the Church or replace him by himself - has to drink it if he doesn´t want to leave it in the cabaret. He does so in mid of cheers and applauses from people who think that he is simply drinking three of four litters of vine.<br /><br />In next scene, the dialoque between Morand and a garbage collector is also remarkable. ""Do you carry away men too?"" asks Morand, who hates himself for what he has just done. ""That would be too much work"" is the smart answer.<br /><br />The rest of the film is not worth commenting but it is certainly worth seeing due to the very strong and strangely emotive atmosphere created all the time.<br /><br />I think that ""Le défroqué"" is a very strange film, but has to be seen by all viewers - if the are good catholiques it is mandatory - because it is a very rare jewell in film history.<br /><br />,positive"
I saw this film some years ago and promptly bought the soundtrack because it was simply excellent. Bacharach's music is endearing and should be given the recognition it richly deserves. The cinematography is awesome. Critics hated it, but they hated HOME ALONE too. I haven't found it on video but welcome anyone who can find a copy.,positive
"The beginning was decent; the ending was alright.<br /><br />Sadly, this movie suffers from complete and utter shallowness of the characters, unrealistic confrontations/fight scenes, lack of anyone intelligent outside of the shuttle. This makes for an awful middle screenplay. <br /><br />Stuff to look for: overly obvious foreshadowing, fast-healing cuts, overly smoky fires, fun seatbelts, delayed reactions.<br /><br />I did give it a 4, not a 0, because the start of the movie had some nice elements of happiness and basic character development. The relationship between the main, dark-haired girl and her fiancée is touched upon briefly, and the placement of the blond friend's impact on that relationship is present, though awkwardly so. The business discovered at the end is becoming more mainstream and decently done, though, as another commenter pointed out, not unexpected. <br /><br />~viper~,negative"
I really enjoyed watching this movie! Only a few parts were slow, but it was only setting the mood and building up to the action. I thought this movie was very educational, it taught me more about my Croatian heritage. I also learned more about Louise Arbour, and I can say she has a very great influence on me. Time magazine named Louise Arbour one of the world's 100 most influential people in April of 2004. I recommend this movie to people that like historical movies (obviously). This movie was very dramatic, but still told the truth of events in the former Yugoslavia. Louise Arbour is a brave hero, and I'm glad they made a movie honouring her. If you see the movie, I hope you'll like it.,positive
Beautiful art direction, excellent editing and wonderful stories make this some of the best television ever produced. The fact that it was relatively short lived is sadly reflective on the state of television. I highly recommend snatching these up as they're released, you'll love them.,positive
"Incomprehensibly dreadful mishmash of the probably most notorious of all Roman emperors who went insane, leaving infamous party orgies and ruthless killings in his path... I know there are several versions of this, and this is based on the 102 min' one that I watched - but I can't fathom how that possibly can make any difference to lift the rest of this movie out of the muck!<br /><br />I'd heard for long about the alleged ""shocking"" content of sex/nudity (which honestly there isn't much of here at all - and boring when there is) and blood, but beware - it's the technical production amateurishness that well and truly shocks here: Everything looks plain and simply like a junior film school flunk project! Camera-work is hopelessly inept, full of strange zooms, failed framing and confusing pans (to and from what mostly looks like a huge theater stage!) complete with a grainy, cheapish photo quality. Lighting and color schemes are terrible and uneven - is it day or night? Are they in- or outside? Have they changed scenes? Who is, or is meant to be in the shot? Editing is the final sin here, making a confusing mess of everything with randomly jumpy cutaways, continuity flaws and random transitions that destroy any chance of momentum, story progression - and involvement. There is potentially interesting dialog and an equally interesting true historical story... but these faults distract so much it's tragic.<br /><br />A story with SO many possibilities to be great is just one gargantuan, burnt (and Fellini-like) turkey that's only good for a few gobble-laughs and Peter O'Toole, who makes a most memorable Tiberius. Oh yes, which brings us to the big-name actors. I'd like to line them all up one by one and just ask: Who did you get free access to bonk in the orgies to be a part of this? There, I've wasted enough lines on one of the truly worst films of all time - period!<br /><br />1 out of 10 from Ozjeppe,negative"
I first saw this movie when I was a freshman in high school, and the film has stuck with me through the years. It's not about the soundtrack, or cinematography, or even the dialogue and somewhat bad acting, it's about the educational purpose, and the message behind that is the most important. It's not a sin to have a child when you're a teenager and still in high school, and it's not really a bad thing, either, but it is a problem. Tons of girls I knew are all having children now, and I guess they never watched this great movie, and if they did, they clearly didn't get the message behind it all. It's about not taking chances when you're in a sexual relationship. Any girl can get pregnant the first time. It's not a myth. You don't necessarily lose out on your dreams, but they do have to take a backseat in your future because you have a child to think about first.<br /><br />This movie has a clear message behind it: JUST SAY NO!,positive
"A clever and bizarre angle to ""Beauty is in the eye of the beholder"". At times you think this is campy and over the top, but the underlying poetic soul comes across strong and believable thanks to the performances of the two leads. One worth tracking down.,positive"
I just saw The Drugs Years on VH1 and I love it. I think it reflects the drug history very well and most importantly IT HAS A STRONG MESSAGE TO THE ALL GENERATIONS. There is woodstock, there are Joplin's, Hendrix's and Jim Morrison's deaths, there are many many examples of drug use and drug abuse. It completely cover the time line and evolution of drug use in America in both good and bad ways. In my opinion this documentary is well done and I would like to congratulate to its creators because this is exactly what is needed to be playing in the TV in these days. I am waiting for the DVD release. You should definitely see it!!! This movie is stunning-- BIG TIME!,positive
K Murli Mohan Rao made the much better BANDHAN in 1998 This film is an awful remake of THE WEDDING SINGER<br /><br />Basically in short, the film consists of: Salman Khan who in those days used to have the role of a dejected lover who looses his girl and also he had his comic scenes where he hammed badly even today he does well he does it all here too and also looses his shirt in scenes<br /><br />Jackie Shroff- wasted, bored and tired, his role is so stupid He is shown as a lover of Pooja Bhatra then in 1 scene he is shown as a womanizer?<br /><br />Inder Kumar- confusing characterization again<br /><br />Rani Mukherjee- boring, overweight and does nothing special Pooja Bhatra- tall, fair and actress worthy but lacks talent<br /><br />Kashmira Shah- says a dial as if a poetry<br /><br />Mohinish Behl- poor fellow the 2 kids were awful too<br /><br />The story is the same and has awful comic scenes, a sudden love story and boring drunken scenes plus a forced comic track of Shakti Kapoor<br /><br />Direction is poor Music is decent<br /><br />Salman khan just goes through the motions, Jackie is bad, Rani is as usual, Pooja is bad, Mohinish and Kashmira are nothing great Inder is awful,negative
College students, who are clearing out a condemned dormitory, are stalked by an elusive killer.<br /><br />The Dorm That Dripped Blood (aka Pranks) is a bit of a mixed bag for slasher fans. The movies production values are pretty low and the story for the most part is pretty routine, there's even a creepy bum hanging around for a red herring. In fact much of the story's build-up is pretty forgettable, save for one or two brutal murders. But the movie is really made better by its surprisingly intense climax (in an atmospheric setting) and one fairly bold, unconventional conclusion.<br /><br />The cast is lackluster for the most part. Stephen Sachs is the best of the lot as he does a pretty nice turn in character. Also look for a young Daphne Zuniga as an ill-fated student.<br /><br />Over all this is a pretty standard B slasher effort, but the finale is well worth savoring and for this viewer saved the movie from being a complete ho-hum.<br /><br />** out of ****,negative
