"one of the funnest mario's i've ever played. the levels are creative, there are fluid controls, and good graphics for its time. there's also a multitude of crazy bosses and enemies to fight. Sometimes the levels get frustrating, and if you leave out some of the hard levels and still, need to get more accomplished to fight a boss, it can be annoying. another complaint is the camera angle; though it works fairly well most of the time, it can be a pain in certain situations. if your a big time mario fan; this ones for you. even if your not a huge fan of him, i'd still recommend this one. its a big game, and getting what you need can take a while, but it's very satisfying. good for playing in short bursts of time. it will almost certainly hold your interest; it sure does hold mine!,positive"
I saw Brother's Shadow at the Tribeca Film Festival and loved it! Judd Hirsch and Scott Cohen are great as father and son. The film follows Scott Cohen from parole in Alaska back to his family in Brooklyn. He shows up there because his brother has died, and he embarks on a journey to slowly repair his estranged relationships with his brother's wife and child and his father who has never forgiven him for being the black sheep of the family. The story takes us deep into the hearts and minds of this family and allows you to more deeply understand the complexity of their lives. Also, the imagery of the woodworking business and the Brooklyn backdrop sets the tone for this rich and revealing family portrait.,positive
"It would be a shame if Tommy Lee Jones and Robert Duval ever see this movie as they will probably be associated with it in years to come. ""Oh yeah"", the public will say, ""'Comanche Moon', that's the mini series about the Texas Rangers and the Comanche Indians that starred Tommy Lee Jones and Robert Duval. It was a real stinker and probably the worst movie they were ever in. I think it was a comedy but a not very funny comedy. I really don't understand why they agreed to be in it"". That would be such an injustice as the original ""Lonesome Dove"" was a true western classic and this turkey is a real bomb and Jones and Duval will be remembered for it.,negative"
"I suppose for 1961 this film was supposed to be "" cool "" , but looking back now ( 45 years ) it's charm was just as silly as it's entertainment value ! Granted , the special effects do well on T.V. with the Series that started in 1964 , but for the BIG screen ?? I once had a fish tank that was equally as exciting ! I must agree about the Octopus scene near the end where it attached itself to the Seaview. Obviously not well staged...or trained ! Overall , it's pretty bad acting with shoddy special effects and I still do recommend it - for fun laughs sake. This was probably one of Irwin Allen's Biggest films and I think he thought a lot of it . Barabara Eden went on to play "" Genie "" on T.V. Micheal Ansara was her Husband . Now that is a cool part about this film ! I always enjoyed seeing real life Husband and Wife teams star in the same movie . Neat !,negative"
"If I rate the film maybe a bit high, you can blame it on sentiment. This is one of the first movies that I remember seeing and totally loving. I saw it at the drive-ins here in California in the late 70s. I was already a big fan of ""The Muppet Show"" on TV so I was primed for the movie, and the movie did not disappoint. Basically it takes the whole absurdist ethos of the Muppet show and transports it from vaudeville into a road movie. Kermit the Frog is on a quest to become famous; not because he wants to take champagne baths and ride in a private jet, but because he wants to ""make millions of people happy."" Of course.<br /><br />Along the way he picks up all his beloved muppet friends, most endearingly Fonzie Bear who he meets at a seedy bar doing stand-up. They sing ""Movin' Right Along"", a song that has always charmed me with its upbeat melody and its theme of friendship and shared discovery. He also encounters enough Hollywood movie stars to fill a Stanley Kramer movie, including comedy luminaries like Richard Pryor, Steve Martin, Edgar Bergen, Milton Berle, and Mel Brooks. Brooks in particular has a rather dull bit, and you are left feeling that Henson could have cut a few of these cameos out if he wasn't afraid of offending the stars. Anyway, as befits a road trip movie like this the very first person he meets is Dom DeLuise.<br /><br />The ending is one of the more odd examples of literally breaking down the 4th wall that you will find in any ""children's"" movie. The Hollywood dream seems to be crumbling all about them, when a real rainbow pierces the Hollywood set with its authentic joy and mystery. I'm sure this was meant to relate to some of Jim Henson's own personal or spiritual experiences.<br /><br />This is the best movie with Muppets by a long shot. If you or anyone else was wondering why the Muppets were so popular back in the 70s, considering how poor the movies have been for the last few decades, I think this film has at least aged well enough to provide a clue.,positive"
"It has been a tradition since my first VHS recorder for me to collect several of the incarnations of the old chestnut by Charles Dickens, and I taped this one and ""Karroll's Christmas"" this year. Fortunately, when this one was run on the Hallmark Channel at the unGodly hour of 3 AM, I was spared having to edit commercials from it. This was, however, it's only saving grace. <br /><br />The writing was excruciatingly dull with almost no clever scenes to save it from being anything more than a teeny-bopper soaper like Beverly Hills 90210. In this one, a good man who was cast aside for her celebrity seems the only logical explanation for her transformation into a Scrooge-like TV talk show hostess. It wasted Dinah Manoff who just plays bitch goddess to the other bitch goddess Tori Spelling (who, by the way, had more coats of paint on her face than some colonial houses) and Bill Shatner is perhaps one of the few fun things in this otherwise dreary adaptation. <br /><br />Some of the best opportunities are wasted like the entrances of the ghosts. Aunt Marla's entrance could have been spectacularly funny in the hands of a decent writer, but this Christmas turkey didn't have one, evidently.<br /><br />Tori Spelling may be a lovely person, but she has all the acting skill of a mannequin, and that makes for a bad show all by itself. <br /><br />Yes, it was good to see Gary Coleman work again, but the script gives him nothing to do really except roll his eyes and spout truly lame dialogue.<br /><br />And what is most infuriating was that the transformation from Scroogedom to Tori ""sweet and light"" is as convincing as a passionate conservative. Now, if anyone wants to write the ultimate Scrooge tale of a George Bush and Karl Rove, we might have a refreshing change from the usual bad Christmas Carol Clones.<br /><br />I suppose if you're a fan of Ms. Spelling and/or 90210, this might be your cup of Christmas cheer. I'd prefer a stiff shot of scotch and a cold beer to wash it down myself. This one I just may cast away before it is with me here for a long long time.<br /><br />God save us everyone!,negative"
Wow, did this episode start on a STOOOOOPID premise! The Enterprise is chugging along when all of the sudden, Abraham Lincoln is floating around in space and welcomes the Enterprise!!!!!!! Is it just me, or is this a really lame-brained idea?! Lincoln comes aboard and they welcome them. Abe suggests they beam down to some barren planet, where they meet other famous dead folks--both good and evil. It seems that a really cheesy-looking rock monster has assembled a team of GOOD and EVIL people to battle it out for supremacy. The whole thing seems really daffy and inherently unfair, as the GOOD side is saddled with Surak--a Vulcan who makes Gandhi seem like Rambo!! Despite a totally AWFUL premise, the action is pretty good and it's great to see overhead shots of obvious doubles fighting it out in this grudge match. But, don't mistake this for high art or deep sci-fi. The bottom line is that the series was on its last legs as a first-run series and this really looked like they dusted off this turkey and filmed it regardless of the absurdity of the premise.,negative
This was a fine example of how an interesting film can be made without using big stars and big effects. Just tell a true story about the struggles of two African American women over a turbulent century.<br /><br />This movie challenges us all to look at our own personal prejudices and see that people are people, not white, black, etc.<br /><br />Good movie with a good message.,positive
"Daddy's girls Florence Lawrence and Dorothy West receive some terrific news at the local post office, unaware they are being stalked by burglar Charles Inslee. Meanwhile, father David Miles receives a message (from young Robert Harron) which necessitates daddy leaving home; so, when the young women return, they can be home alone. As the vulnerable pair bed down for the evening, the local ""Grand Ball of the Black and Tans"" gets underway; and, a dark-skinned drinker portends additional danger for D.W. Griffith's dynamic duo <br /><br />Mr. Inslee has one of his better Biograph roles, stealing the film from ""The Girls and Daddy"". Ironically, Director Griffith appears as one of the black-faced extras at the ""Black and Tans"" ball. ""Biograph Girls"" Lawrence and West are suggestive of later ""Griffith Girls"" Lillian and Dorothy Gish, especially in ""Orphans of the Storm"" (1921); and, they are excessively affectionate in bed! The racist tone is unfortunate, since the story of a burglar redeemed by saving his potential victims from a greater danger, is intriguing. <br /><br />*** The Girls and Daddy (2/1/09) D.W. Griffith ~ Florence Lawrence, Dorothy West, Charles Inslee,negative"
I loved this show from it's first airing, and I always looked forward to watching each episode every week. The plot, characters, writing, special affects were outstanding! Then the sci-fi channel screwed up yet again and canceled a very entertaining, well written show. I say bring it back, I know all of the actors would come back. I would suggest buying the DVD's, I am. I hope the sci-fi channels executives get word of these comments, and realize that they need to be more involved with their viewers. I only watch one show on that channel now, (Ghost Hunters), but I am fairly sure that shortly they will cancel that too.,positive
Director Edward Sedgwick, an old hand at visual comedy, successfully leads this Hal Roach road show which tenders a fast-moving and adroit scenario and excellent casting, employing a large number of Roach's reliable performers. Although the film was originally plotted as a vehicle for Patsy Kelly, sunny Jack Haley stars as Joe Jenkins, a young Kansan who sells his auto repair business and journeys to Hollywood, where he attempts to wangle a screen role for the girl he loves, star-struck Cecilia (Rosina Lawrence). Sedgwick, who prefers using the entire M-G-M studio as his set, does so here as Cecilia, always ready for an audition, is treated by a would-be paramour, cinema star Rinaldo Lopez (Mischa Auer), to behind-the-scenes action of, naturally, a musical comedy, featuring Broadway headliner Lyda Roberti. Laurel and Hardy provide several enjoyable interludes, including their well-known skit involving a tiny harmonica, and we watch fine turns by such as Joyce Compton, Russell Hicks and Walter Long. On balance, one must hand the bays to Mischa Auer, who clearly steals the picture as an emotional movie star, a role which he largely creates, and to the director for his clever closing homage to Busby Berkeley's filmic spectacles.,positive
"In the groovy mid 70's a scruffy bunch of brash young Venice, California adolescents from broken homes and the bad side of town known as the Z-Boys turned the previously staid world of professional skateboarding on its ear with their fierce punk attitude, radical unconventional riding style, and unbridled spirit of pure in-your-face aggression, revolutionizing the sport in the process and paving the way for the many extreme variations on sports that popped up in their influential wake. Director Stacy Peralta, who's one of the legendary Z-Boys himself, relates the incredible exploits of this amazing ragtag crew in a ferociously punchy and visceral manner that's both informative and wildly entertaining: the snappy rapid-fire editing, ceaseless speedy pace, and raw, gritty photography deliver one hell of an infectiously kinetic buzz, projecting a sense of sheer joy and full-on bustling energy that's a total pleasure to behold. Better still, this documentary neither sanitizes nor romanticizes its subjects: These rough'n'scrappy lads were so fiercely competitive and out for themselves that they all went their separate ways when the lure of fame and fortune manifested in their lives. The ultimate fates of certain guys is poignant and heartbreaking, with gifted and spontaneous ace skateboard rat Jay Adams rating as the saddest and most tragic: He blew his chance at the big time and wound up doing time in jail. The other dudes are very colorful and personable as well; charismatic ball of cocky and defiant fire Tony Alva in particular comes across as one arrogant, yet impressive piece of furiously assertive work. Marvelously narrated with delightfully easy'n'breezy nasal nonchalance by Sean Penn. The terrific rock soundtrack likewise seriously smokes. But what really makes this documentary such a winner is its refreshing complete dearth of pretense: It's every bit as dynamic, exuberant and larger-than-life extraordinary as the gloriously outrageous Z-Boys themselves.,positive"
How can a major German TV station broadcast a mess like this? It's amazing how the main actors avoid every acting talent - Even the well-known Gottfried John is acting very poor - especially in the double murder scene - how amateurish.......! The screen plan is very , very extended - perhaps to fill out 2 parts of the movie. Be careful not to fall asleep while watching! The set is obviously very often a blue screen, f.g. the scenes on the ship with unreal sea in background...! In the German version the sound and the dubbing is very poor - probably reason: different languages of actors - but: other international productions do handle this much more professional. Advice: Do NOT watch - it's a diabolic waste of time!,negative
This is a bad movie. Not one of the funny bad ones either. This is a lousy bad one. It was actually painful to watch. The direction was awful,with lots of jumping around and the green and yellow hues used throughout the movie makes the characters look sickly. Keira Knightly was not convincing as a tough chick at all,and I cannot believe Lucy Liu and Mickey Rourke signed on for this criminal waste of celluloid. The script was terrible and the acting was like fingernails across a chalkboard. If you haven't seen it,don't. You are not missing anything and will only waste two hours of your life watching this drivel .I have seen bad movies before and even enjoyed them due to their faults. This one is just a waste of time.,negative
"About your terrible movie copying Beethoven. As a professional musician it's my duty to watch every movie made about any composer and Beethoven is one of my favorites. When Hungarians and Americans meet, it's a terrible combination of empty over the top emotions combined with the worst taste possible. You proved it in your terrible b-movie. The only thing that carries the movie is the music. Of course you didn't bother to look further than the good but in my taste contrived performances of the Tackacs quartet, but OK I have to admit that the performances at least have quality as contrast to the movie you've made. It starts of with the dying DEAF Beethoven who perfectly understands Anna who is merely whispering. Beethoven's hearing during the movie get's better by the minute, but that must be because of some vague divine thing. Then there is the quite impossible semi-pornographic ""eyes wide shut"" double-conducting scene which is totally over the top with the luscious Anna and the crying nephew in the end (who also cries in the deleted scenes with constant red eyes, my GOD what a performance). And as culmination the rip-off from Amadeus, with Beethoven dictating music to Anna not in notes but in total nonsense, which she understands perfectly but no-one else in your audience even trained professional musicians will understand. Of course your reaction will be that negative response is a response at least, but I can assure you that Beethoven himself is turning in his grave because of your worthless creation and with reason. This so called homage is blasphemy and I am so sorry to have rented one of the worst movies ever made even though it's about my favorite subject. Ed Harris and others, you cannot comprehend the greatness of Beethoven in your wildest dreams and certainly not after a couple of lessons in conducting and violin playing. That's the trouble with you Americans: you think you can grasp everything even when it takes a lifetime of hard work. Yeah we can do it anyway! Remember that a good product comes with hard labor, talent, devotion and professionalism. All these you creators of Copying Beethoven lack. See you in kindergarten.,negative"
"Good Lord, what were they THINKING??!!!!!! Here is your spoiler warning, even though I don't think it'll really matter. You won't be seeing this piece of trash anyway.<br /><br />A group of handpuppets go chasing after a group of really stupid people, who go on a really stupid hunt for them to try and kill them, and the puppets complicate things by letting them live out their really stupid fantasies. In other words, the whole thing is really stupid.<br /><br />You KNOW it has to be bad when even Mike and the Bots can't save something!! And they didn't! I know, some of their lines were funny, like what to add to the sign ""HIT"" and the hand comments, but, geez, this was pretty dang sad.<br /><br />All I can say is DO NOT WATCH THIS PIECE O CRUD. IT IS NOT WORTH YOUR EYES.,negative"
There was nothing remotely funny about this movie. It makes fun of various sports movies and clichés but nothing about it is remotely funny. Most of the movies they parody doesn't even fit in with the film and are really only their so they can be in it. Non The main actor was well cast in it but that's really the only good thing about this film. Also the various cameos in it were kind of cool to see but i have no idea why they would waste their time being in this piece of garbage. Thank goodness I only spent $4 on it as this is not something worth spending money on. ONly watch if you have absolutely nothing to do or just want to waste an hour and 30 minutes.,negative
"Having loved Stephen King's novels and short stories for many years, I, like most reviewers, have been consistently disappointed in the adaptations to film from his printed works. A few notable exceptions are ""Stand By Me"" from ""The Body"", ""Carrie"" from the novel of the same name, and ""The Shawshank Redemption"" from ""Rita Heyworth and Shawshank Redemption"". This movie is by far the worst thing that has ever been produced with Stephen King's name attached to it in any way. It is no surprise that Mr. King has pretty much disavowed any connection with it. I feel the thing that most offended me about this poorly acted, cheaply filmed, hideously directed piece of garbage is that they had the audacity to COMPLETELY change the ending Don't waste your time or money on this amazing bow-wow of a movie!!,negative"
"After starting watching the re-runs of old Columbo movies, I thought they would all get about the same vote from me (6). But apparently I'm now starting to see differences in the movies. It happened in some of just previous episodes, that showed some pretty genius directing, and it shows in this one, but in the negative way.<br /><br />The movie was so boring, that I sometimes found myself occupied peaking in the paper instead of watching (never happened during a Columbo movie before!), and sometimes it was so embarrassing that I had to look away. The directing seems too pretentious. The scenes with the ""oh-so-mature"" neighbour-girl are a misplace. And generally the lines and plot is weaker than the average episode. Then scene where they debated whether or not to sack the trumpeter (who falsely was accused for the murder) is pure horror, really stupid.<br /><br />Some applause should be given to the ""prelude"" however. In this episode, a lot of focus is given on how the murderer tries to secure his alibi and hide the evidence etc. I really liked that. But alas, no focus on how Columbo reveals all this. And the ""proof"" that in the end leaves Columbo victorious is the silliest ever.<br /><br />Rating: lies between 4 and 5,negative"
One has to wonder if at any point in the production of this film a<br /><br />script existed that made any sense. Was the rough cut 3 hours<br /><br />long and was it trimmed into the incoherent mess that survives? <br /><br />Why would anyone finance this mess? I will say that Tom<br /><br />Wlaschiha is a good looking young man and he does what he can<br /><br />with the dialogue and dramatic (?) situations he is given. But<br /><br />characters come and go for no apparent reason, continuity is<br /><br />non-existent, and the acting, cinematography, and direction are (to<br /><br />put it politely) amateurish. Not One Sleeps is an unfortunate<br /><br />choice of title as it will probably prove untrue should anyone<br /><br />actually attempt to actually watch this film.,negative
The Lives of the Saints starts off with an atmospheric vision of London as a bustling city of busy, quaint streets and sunshine. I was hoping it would maintain this atmosphere, but it gets bogged down in a story that goes pretty much nowhere.<br /><br />Othello works for big, fat Mr. Karva, his crime-boss step-dad (at least I think that is what he is supposed to be because it's never really defined, but he does drop kittens into deep fat friers, so trust me, he's a prick) doing scrappy little errands while his skanky girlfriend gives daddy hand-jobs. One of his colleagues is Runner, a black dude who is always dashing from A to B. Until the day he comes across almost mute homeless child who grants him his wish of being able to stop running. Runner dumps the lost boy in Othello's flat, where he promptly starts granting more wishes. Keen to have some of his own desires fulfilled, Karva has the boy kidnapped. But he isn't sure of what would really bring him happiness. Is it the innocence of being a child again or is it another hand-job? Either way, I don't want to see the little boy grant him the second.<br /><br />It just takes ages to get going and there are loads of repetitive scenes. The ending tries to be shocking but since there's hardly any back-story on investment in any of these characters it only serves as a release for the bored audience.<br /><br />Writer Tony Grisoni, a favourite of Terry Gilliam, tries to blend in some kind of religious allegory which ends up being pretentious as all hell, ironically. If he gave us something more accessible or at least had better explanations for the characters suddenly acting all weird then it would have been a more enjoyable film. As it is, we are introduced to a bunch of annoying loudmouths who then miraculously seem to develop intelligence when confronted by the mysterious boy. Who's origins are never revealed. That's just plain irritating! <br /><br />Aside from sporadic moments of atmosphere and a moody score, this film has little to recommend.,negative
"If you are a traveller, if there is a fire burning into your heart, if you'd call ""home"" every place on earth, but none of them can give you enough, if you are always looking for the next thing and if you believe the other part of your soul is somewhere out there, see this movie and you'll find out a little, but wonderful, piece of life sitting next to you.,positive"
"John Huston was seriously ill when he made his final achievement,and it's thoroughly his testament:uncompromising,difficult ,a thousand miles away from crazes and fashions,it will stand as the best ""last film"" you can ever dream of.A very austere screenplay,no action,no real hero,but a group of people coping with the vanity of life,the fleeting years and death.The party doesn't delude people for long.Admittedly,warmth and affection emanate from the songs and the meal,complete with turkey and pudding.But the passage of time has partly ruined Julia's voice,first crack in the mirror.Then the camera leaves the room where the guests are gathered and searches the old lady's bedroom.For sure,hers seems to have been a happy life,but it's a life inexorably coming to an end-A shot shows towards the end of the movie Julia on her future deathbed-.Maybe an unfulfilled life,because she remained a spinster,with no children to carry on .Only some poor things,yellowish photographs,bibelots and trinklets.... But are a human being's hopes and dreams all fulfilled?Look at Gretta.She 's a married woman ,about thirty-five,she's still beautiful and healthy but she knows something is broken.What Julia is today,she will be tomorrow,that's why,in her stream of consciousness,she goes back to her past,only to find out how harrowing her memories are: a young man committed suicide for her,a symbol of her youth now waning.The final monologue,if we listen closely to it,involves us all in this eternal tragedy,the doomed to failure human condition,John Huston's masterly lesson.,positive"
