"I've read a lot of reviews about Showtime on IMDb and many seem to miss the mark. I've noticed a lot of reviewers calling this the typical ""buddy"" film. De Niro is in no way Murphy's buddy throughout most of this movie. In fact, part of the comedy of this film is De Niro's reluctance to be friends with anybody.<br /><br />Murphy really shines in this one. He is back at doing what he does best, acting like a complete ham. He is a cop who wants so much to be an actor and enjoys being in the reality show. De Niro is perfect as the straight man who thinks the entire thing is stupid. I thought the two of them had great chemistry and were a perfect casting choice. Rene Russo is also great as the TV producer. Of course, she loves everything Murphy does and tries so hard (along with Murhpy) to get DeNiro going too.<br /><br />A lot of reviewers have touched on the hilarious scene with William Shatner, reprising his role as TJ Hooker to train Murhpy & De Niro how to ""act"" like cops. But, my favorite scene involves Murphy in the ""confessional"" hoping he could get a Wesly Snipes-Like cop to team up with instead of De Niro. Man, that was hilarious! Comedies often depend on your personal tastes. Sure you could poke holes in the plot, most often you can with a comedy. I was psyched to see the pairing of Murphy and De Niro...I think it brought out the best in Murphy, which was nice to see him at the top of his game again. I can only imagine it was a great honor for Murphy to be paired with the great De Niro. Rating 8 of 10 stars.,positive"
"I just started watching The Show around July. I found it by mistake, I was channel surfing during a Vacation. It is a great show, I just wish it wasn't on so late at night. It's on at 12:30 AM. As a working person it makes it hard to watch all the time.<br /><br />I read some comments. I did not agree with the late one about not growing up in the 60's and not believing that this stuff can happen.<br /><br />I grew up in the 60's. I'm Hispanic and I had a ""White"" boyfriend plus we had black friends in High School. I believe people get along because of their interests and personalities and it has nothing to do with being a certain race or color.<br /><br />I can't wait till the show goes on DVD so I can buy it. This way I can see it from the beginning.,positive"
I've seen hundreds of silent movies. Some will always be classics (such as Nosferatu, Metropolis, The General and Wings) but among them, my favorite is this film (it may not be the best--but a favorite, yes). In fact, when I looked it up on IMDb, I noticed I immediately laughed to myself because the movie was so gosh-darn cute and well-made. Marion Davies proved with this movie she really had great talent and was not JUST William Randolph Hearst's mistress.<br /><br />The story involves a hick from Georgia coming to Hollywood with every expectation that she would be an instant star! Her experiences and the interesting cameos of stars of the era make this a real treat for movie buffs and a must-see!,positive
I think the manuscript of this movie was written on the piece of toilet-paper. No respect whatsoever to many important details which intrinsically make the movie. For example, the names of some Serbian terrorists (that I remember) are Caradan Maldic, Ivanic Loyvek and Leo Hasse. What kind of names are that? Certainly not Serbian! By the way, Caradan Maldic!!! What a name, I laughed for days thinking about it. Probably an implication on Karadzic and Mladic. Secondly, there have never been any cases of terrorism done by Serbians. A journalist like the main character ought to have known that. Thirdly, the actors playing Serbian terrorists are not even Serbs nor do they speak Serbo-croatian. All this aside, this movie is solidly acted but the story is paper-thin and full of holes. At times it makes no sense whatsoever!!!,negative
I remember this film,it was the first film i had watched at the cinema the picture was dark in places i was very nervous it was back in 74/75 my Dad took me my brother & sister to Newbury cinema in Newbury Berkshire England. I recall the tigers and the lots of snow in the film also the appearance of Grizzly Adams actor Dan Haggery i think one of the tigers gets shot and dies. If anyone knows where to find this on DVD etc please let me know.The cinema now has been turned in a fitness club which is a very big shame as the nearest cinema now is 20 miles away, would love to hear from others who have seen this film or any other like it.,positive
"Prue and Piper bring Dr. Griffiths to their home to save him from the Sauce's assassin Shax. While Phoebe looks in the Book of Shadow how to vanquish the demon, Prue and Piper fight and chase Shax on the streets to destroy him. However, they are filmed and exposed live in the television news as witches. They become national sensation with a crowd in front of their house. Phoebe trusts on Cole and goes to the underworld with Leo to ask him to summon Tempus and revert time while a fanatic woman shots Piper, who dies. The source proposes Phoebe to stay with him and in return he would save her sister. Phoebe accepts the deal, and the time is reverted to the moment Shax is attacking Prue, Piper and Dr. Griffits.<br /><br />""All Hell Breaks Loose"" is a good but incoherent episode. With Piper dead and The Power of Three destroyed, why should The Source revert time to save her? But this dramatic show is certainly one of the best of the Third Season and let the viewers anxiously waiting for the next episode. My vote is nine.<br /><br />Title (Brazil): ""Voltando no Tempo"" (""Back in Time""),positive"
This movie sets out to do something very particular, it also sets out not to do certain things. In short it has a definite premeditated trajectory - to deal with the idea of facing death (with very few choices and all of them bad) as grave and real rather than something casual or amusing. In search of that realism it has eschewed certain conventions such as obvious character arcs and hooks. It not about the characters so much as about the human condition. Never mind what the actors would do... what would YOU do in their situation? <br /><br />Open Water may have been a starting notion for this movie but it goes a lot further. Unlike that film it doesn't cheat the audience in the end when you find out there aren't really any sharks to speak of at all. This has a real monster, not just the idea of a monster and not just an animated stand in. It also has fine production values given what these very resourceful filmmakers had to work with. And again in contrast to that other film it has some exhilarating and brilliantly rendered action at it's climax. And let's not forget the, shall we say 'dazzling', screen presence of its youngest star. She may prove to be quite a discovery.,positive
"I was surprised that "" Forgiving the Franklins "" did not generate more buzz at this years Sundance Film Festival. There were times that the laughter at the screening I saw was so loud that you could barely hear the movie. The movie has some excellent acting and a story that really makes one examine broader issues . You know little issues like Religion, sex and the truth. Lots of comedy's seem to rely on the same old corny contrived situations, many leave you thinking "" I know they ripped this off from some sitcom "" .This film takes off on its own unique direction . I really think that Jay Floyd did a fantastic job with a tight budget on this film.,positive"
I feel as though I know these people and have known people similar to them. These days, though, people are discouraged from showing such passion about anything especially love and loneliness. It has a slow beginning, but then look out! If you love romantic comedies, but would like to see one that had some basis in reality for a change {or at least did have back in the 70's}, then you should see this movie!,positive
"If I'd only seen the poster for Nurse Betty, I probably wouldn't have touched it with a ten-foot pole. But after I heard some positive buzz, and knowing it made some noise at Cannes, I decided to give it a try. What I got is a truly enjoyable movie, based on a very entertaining plot. Rene Zelleweger is impressive in her role as nurse' Betty, a woman who is sent into a delusional psychotic episode following a traumatic experience. I also liked Morgan Freeman (no surprise) and was pleasantly surprised by foul-mouthed comedian Chris Rock. <br /><br />The film bounces continuously between comedy, drama, romance, and thriller. Yet despite this apparent identity crisis, it holds up quite well. I found my eyes glued to the screen from beginning to end always waiting for the next twist in the story. The entire cast is strong, if not spectacular. <br /><br />My only real complaint is that director Neil Labute (who made a splash a few years ago with the very impressive and dark In the Company of Men') relied much too heavily on many cliched Hollywood conventions. The mood-creating musical effects he crammed down our throats during each sentimental scene were unbearable! And he did the standard old ""let's take some of the minor characters and pair them up at the end in an illogical and unnecessary romance"" trick, just to make absolutely certain everyone goes home with a smile on their face. Why must directors and writers treat their audiences like idiots??<br /><br />But the movie is still much too enjoyable to be dragged down very far by these annoying irritations. In a very subpar year for movies, 'Nurse Betty' ranks as one of the more pleasant surprises of 2000. 8 out of 10.,positive"
Johnny and June Carter Cash financed this film which is a traditional rendering of the Gospel stories. The music is great, you get a real feel of what the world of Jesus looked like (I've been there too), and June gets into the part of Mary Magdalene with a passion. Cash's narration is good too.<br /><br />But....<br /><br />1. The actor who played Jesus was miscast. 2. There is no edge to the story like Cash puts in some of his faith based music. 3. Because it is uncompelling, I doubt we'll see this ever widely distributed again.<br /><br />I'd love to buy the CD.<br /><br />Tom Paine Texas, USA,positive
"Although I have enjoyed Bing Crosby in other movies, I find this movie to be particularly grating. Maybe because I'm from a different era and a different country, but I found Crosby's continual references to the Good Old USA pleasant at first, trite after a while and then finally annoying. Don't get me wrong - I'm not anti-American whatsoever - but it seemed that the English could do no right and/or needed this brave, oh so smart American visitor to show them the way. It's a ""fish out of water"" story, but unlike most movies of this sort, this time it's the ""fish"" who has the upper hand. To be fair to both myself and the movie, I have watched it a few times spaced over a few years and get the same impression each time.<br /><br />(I watched another Crosby movie last night - The Emperor's Waltz - and that, too, produced the same reaction in me. And to my surprise even my wife - who for what's it's worth is American - found the ""in your face"" attitude of American Crosby to be irritating. One too many references to Teddy Roosevelt, as she put it.) <br /><br />As for the premise of the movie, it's unique enough for its day and the supporting cast is of course very good. The scenery and the music is also good, as are the great costumes - although I agree with a previous reviewer that the wig on William Bendix looks horrid (picture Moe of The Three Stooges).<br /><br />All in all for me this would be a much more enjoyable picture without the attitude of Bing Crosby but because he is in virtually every shot it's pretty hard to sit through this movie.,negative"
"""Zen and the Art of Lanscaping"", written and directed by David Kartch is a short film about a young man named David (his friends call him Zen) and what transpires in one strange day of his life. Zen works as a lanscaper for an upper-middle class family. The lady of the house tries to get Zen to help her cheat on her husband. Unfortunately, her son walks in on them instead of her husband. From this point on the movie starts to speed through many revelations between the characters along with the eventual involvement of the man of the house. ""Zen and the Art of Landscaping"" is witty, smart and overall very well written. The comedic timing of the actors is also very strong. It's a fun, light movie that I would strongly recommend.,positive"
Tim Robbins and John Cusack are two actors I have appreciated throughout their careers, and that was the only reason for choosing to watch this movie. Well, all I can say is I totally regretted it! These two great actors humiliate themselves all the way through by performing a number of irrelevant, unimaginative and kitch to the extreme (not that this is bad on its own)sketches that are supposed to make people laugh, but fail to do so. The only reason I can think is that the director was their friend, and they decided to support his movie by starring in it-I can't think of anything else because this movie is SO cheap! Fortunately Tim Robbins and John Cusack haven't disappointed me ever since. I would recommend you to avoid this film, unless you want your opinion about the two actors spoiled.,negative
this movie gets a 10 because there is a lot of gore in it.who cares about the plot or the acting.this is an Italian horror movie people so you know you can't expect much from the acting or the plot.everybody knows fulci took footage from other movies and added it to this one.since i never seen any of the movies that he took footage from it didn't matter to me.the Italian godfather of gore out done himself with this movie.this is one of the goriest Italian movies you will ever see.no gore hound should be without this movie in their horror movie collection.buy this movie no matter what it is a horehounds dream come true.,positive
The mystery here is why this delightful, small comedy has been ignored by most critics and has failed to find the audience it deserves. Simply showcasing the budding talent of Audrey Tautou should be enough to generate greater recognition from the cognoscenti. <br /><br />Lacking in pretension and relying on quirky characterizations, itÕs rumination on the interconnection of human behavior manages to be both amusing and life affirming and, unlike some of itsÕ more critically acclaimed competition in the genre, such as The Taste of Others, it actually entertains.,positive
"This sports a nice, deep cast but for a thriller you better deliver more than name actors and talk. The first third of this movie was nothing but talk, and more talk. Most of that was a bunch of women bitching about everything to each other. <br /><br />The first five listed actors in here are women so that verifies that it's really a ""chick flick"" and little else. This probably plays on the Lifetime network.<br /><br />There was a quick murder scene and then more talk. By halfway through, they had lost me. <br /><br />By the way, Sally Field looked about 15 years old in here.,negative"
Wonderful film that mixes documentary and fiction in a way that makes the spectator question: what is the extent of truth in documentary films or is there such a thing as an objective documentary.,positive
My kids picked this out at the video store...it's great to hear Liza as Dorothy cause she sounds just like her mom. But there are too many bad songs, and the animation is pretty crude compared to other cartoons of that time.,negative
"I couldn't tell if ""The Screaming Skull"" was trying to be a Hitchcock rip off or a modernized Edgar Allen Poe tribute. These days, someone would have chopped it up a bit and presented it as one of those TV anthology episodes from the old ""Tales From The Dark Side""...but only after an extensive rewrite.<br /><br />The sad thing is, there seems to be a nice, nasty little story trying to get out from under the rubble of this movie, and the actors are obviously doing the best they can with both their talent and the material they have to work with. But the director just didn't know how to stage or pace a dramatic scene; the special effects simply didn't work; the screenplay telegraphed its threadbare plot points so plainly that a bivalve could have seen them coming; and the soundtrack kept playing German ""oompah band"" music when it was supposed to be trying to scare the audience. <br /><br />They tried; they tried really hard. But this is of interest only as a period piece.I suppose someone very young who hadn't seen a lot of suspense or horror might get a charge out ""The Screaming Skull"", but someone that young probably wouldn't get most of the subtext or plot motivation. (""Mommy, why is that nice man trying to scare the twisty faced scaredy-cat lady??""),negative"
The Last Hard Men finds James Coburn an outlaw doing a long sentence breaking free from a chain gang. Do he and his friends head for the Mexican border from jail and safety. No they don't because Coburn has a mission of revenge. To kill the peace officer who brought him in and in the process killed his woman.<br /><br />That peace officer is Charlton Heston who is now retired and he knows what Coburn is after. As he explains it to his daughter, Barbara Hershey, Coburn was holed up in a shack and was involved in a Waco like standoff. His Indian woman was killed in the hail of bullets fired. It's not something he's proud of, she was a collateral casualty in a manhunt.<br /><br />Lest we feel sorry for Coburn he lets us know full well what an evil man he truly is. Heston is his usual stalwart hero, but the acting honors in The Last Hard Men go to James Coburn. He blows everyone else off the screen when he's on. <br /><br />Coburn gets the bright idea of making sure Heston trails him by kidnapping Hershey and taking her to an Indian reservation where the white authorities can't touch him. He knows that Heston has to make it personal then.<br /><br />Coburn's gang includes, Morgan Paull, Thalmus Rasulala, John Quade, Larry Wilcox, and Jorge Rivero. Heston has Chris Mitchum along who is his son-in-law to be.<br /><br />The Last Hard Men is one nasty and brutal western. Andrew McLaglen directed it and I'm thinking it may have been a project originally intended for Sam Peckinpaugh. It sure shows a lot of his influence with the liberal use of slow motion to accentuate the violence. Of which there is a lot. <br /><br />For a little Peckinpaugh lite, The Last Hard Men is your film.,positive
Children love dinosaurs. It's somewhat part of their culture. But they've got The Land Before Time. The original. At least that movie had heart. This. This movie is just plain pathetic. Just because kids love dinosaurs doesn't mean you can just slap together any old story and show it to the children. This movie has no plot, the whole premise is stupid, and it's more by the numbers stuff. Not as soul sucking as Theodore Rex, but it's lightyears away from being a Land Before Time.,negative
"some would argue this is better mainly because of the acting; but it is indeed far worse for reasons that outweigh the improvement.<br /><br />the source from which all the problems stem; the story. aside from one of them people being shot point blank, with a shotgun, in the chest and surviving for hours without medical attention, there is a bigger problem. Nic, the gangsta with the golden heart is willing to do anything for the friend he just met that day; and that includes asking an evil spirit for help. Ce-Ce, who comes out of nowhere with a past in voodoo, is willing to summon Killjoy, so long as Nic can ""hook her up."" the acting, while improved, is still horrid. these people couldn't convey emotion out of a paper bag. the script doesn't help them either. stupid lines, and i can only assume no direction from the director. this script was read like Shakespeare in high school with a teacher whipping them as they went.<br /><br />while this movie (if you can call it that at its 80 min. run time (thankfully)) is perhaps even funnier than the first because of all these things, it is definitely more painful to watch. 1/10.,negative"
"My guess is that the producers of this low-budget space/horror film wanted a serious movie but the director had his heart set on a parody. So...this is what we get. Set in an abandoned spaceship 1000 years in the future and peopled with characters and props right out of the 90's. The set is some industrial complex, maybe an oil tanker, whatever. They use is AS IS so the controls consist racks of old TV equipment. One location is obviously the employees lunchroom and sports an old TV and VCR as well as a water cooler with plastic demijohn. Tiny Lister and Coolio get the best lines, arguing throughout the story. The dialog is packed with terms that are pretty dated even now (""A-OK, Daddy-O"") but then maybe the 30th century is very retro? When the captain declares the ships cargo is a load of coffins from ""The Transylvania Station"" you know this is all a put-on. Its a bit of Alien, part JasonX, shameless rip-off of all the best sci-fi and horror titles. At one point Casper VanDien even tells his pilot to ""make it so"" with a straight face. This film would have been better if they had just let everyone run with the satire but they keep attempting to make the story serious....maybe the backers were on the set that day. Anyway, not a bad boredom killer if you aren't too picky. FX are as good as the sets are bad.,negative"
"Worst Movie I Have Ever Seen! 90 Minutes of excruciating film-making. All the ingredients to make this movie a true work of CRAP. Bad acting, bad directing, bad storytelling, bad makeup, bad dialogue, bad effects, and bad reasoning behind certain actions taken by the characters. It also threw in a terrible naked shot of a dumb blond, and a breast shot of a stupid Asian girl, and both attempts were just scary, since these girls are ugly. Some good horror movies came out of the 80s, but this could never be considered one of them. Kevin Tenney also committed one of the greatest sins in storytelling: he introduced characters at the end of the movie (an Old Man and Old Woman). I would vote for it below a 1 out of 10 but the voting system doesn't work that way apparently. Right from the title sequence I knew it would suck and I would return my DVD but Best Buy doesn't refund DVDs, or consumable products as they call it, or so my receipt says. I have ""The Dunwich Horror"" and that was truly god-awful, but I still feel that ""Night of the Demons"" (an obvious Evil Dead RIP-OFF) was far worse than ""Dunwich Horror."" This is just like ""The Howling,"" how in the hell could sequels get milked out of this anorexic cow??? Save your money and get the ""Texas Chainsaw Massacre"" (just don't get any of its sequels though) or ""The Evil Dead"" or ""Dawn of the Dead."" ""Night of the Demons"" is a very, very, very bad investment. Every second of it was just maddening, excruciating pain for the audience, because the whole movie all-around was horrible! Do yourself a favor, DON'T SEE IT! You'll be saving some brain cells.,negative"
"It was a serious attempt to show the developing sexuality of two schoolgirls and did not try to exploit its fact Even by today's standards, the film is interesting and provocative <br /><br />Therese and Isabelle are both attending the same girl's school Therese is energetic, intelligent, and becomes a mentor for the innocent, naive, sweet Isabelle She guides her through a number of exotic experiences, including a trip through an exclusive brothel, into her first lesbian liaison, and indirectly into her first heterosexual experience <br /><br />The film does not exploit any sex, nor is there an abundance of nudity... The imagery is effective, but sometimes the camera lingers too long, and the story goes slowly <br /><br />The director, Radley Metzger, went on to make a number of explicit erotic films under the name of Henry Paris He always has extremely detailed stories, good acting, and very high standards of cinematography...<br /><br />Artistically, however, this is perhaps his most complete His later attempts supplied for entertainment, whereas ""Therese and Isabelle"" was a study into the nature of youthful eroticism...,positive"
Incredibly ARTISTIC NOBODY COULD MAKE THEM NOW I THINK.It seem to be perfect the biggest and the greatest musical ever made listen to the beautiful songs the are quite poetry.I'M Italian AND ADMIRED BY American MUSICAL. why can't you do something like that now?American were the best and for that i absolutely show my devotion to you with this movie.there are words to describes the perfection of this movie. all of a sudden my heart sings, what makes the sunset? i fall in love to easily,jealousy...and the scene with Tom and Jerry. the greatest without reserve. if you you doesn't know your eyes are not open my friends you must see it and appreciate...wake up!,positive
Four great stories from master Robert Bloch, adapted to the screen by the best actors in the field in the early Seventies, are the base of this excellent Amicus' production. This was a kind of movie very popular in the Sixties till the mid-Seventies and it's one of my favorite type of horror movies. This one in particular shines for the episode Sweets to the Sweet, where Christopher Lee is stalked by his evil little girl child, heiress to her mother tradition. Great fun from start to finish, and good to very good are also the other three episodes (with the last one a bit on the comic side, but with the great addition of Ingrid Pitt, the most famous vampress of the English cinema.,positive
