A teen-aged girl gets the horse of her dreams and is trained by an ex-Jockey to participate in London's Grand National Steeplechase. A fine adaptation of the classic children's book, with an excellent, start-making performance by Taylor as the energetic but polite youngster. Rooney is OK as her trainer, although he has some overly melodramatic moments. Crisp and Revere are quite good as Taylor's loving parents. Filmed in Technicolor, it looks beautiful. The problems are that there are corny elements, nothing very interesting happens, and it drags on a bit too long. The race is exciting but could have been much more so.,positive
As far as I know the real guy that the main actor is playing saw his performance and said it was an outstanding portrayal, I'd agree with him. This is a fantastic film about a quite gifted boy/man with a special body part helping him. Oscar and BAFTA winning, and Golden Globe nominated Daniel Day-Lewis plays Christy Browna crippled man with cerebral palsy who spends most of his life on the floor, in a wheelchair and carried by his family. He has a special left foot though, he can write with it, paint with it and hold things with it. He learns to speak later in the film, it is very good for a guy like him. Also starring Home Alone 2's Oscar winning, and Golden Globe nominated Brenda Fricker as Mrs. Brown and BAFTA winning Ray McAnally as Mr. Brown. It was nominated the Oscars for Best Director for Jim Sheridan, Best Writing, Screenplay Based on Material from Another Medium and Best Picture, it was nominated the BAFTAs for Best Film, Best Make Up Artist and Best Adapted Screenplay. Daniel Day-Lewis was number 85 on The 100 Greatest Movie Stars, he was number 20 on The 50 Greatest British Actors, he was number 9 on Britain's Finest Actors, and he was number 15 on The World's Greatest Actor, and the film was number 28 on The 50 Greatest British Films. Outstanding!,positive
STAR RATING: ***** Saturday Night **** Friday Night *** Friday Morning ** Sunday Night * Monday Morning <br /><br />Unorthodox journalist Mike Sullivan (Vinnie Jones) flits away his time winding up the local constabulary and trying to romance a member of police personnel. But everything changes when the landlady of the Thames side pub he frequents is found murdered and a transcript of an unpublished novel cum confession by legendary writer Charles Dickens is found. As he digs deeper into both mysteries, he is plunged further into mystery and danger than he bargained for.<br /><br />In 1998, former footballer Vinnie Jones shot out of nowhere and took everyone by surprise with his gangster cult classic Lock, Stock and Two Smoking Barrels. Okay, no one was blown away by his acting ability, but his presence as a hard man looked set to ensure a decent career as a movie tough guy. But it all proved to be a one hit wonder, and all he really achieved after this was supporting role status amongst far more acclaimed actors in films like Gone in Sixty Seconds and Swordfish, before descending into the realm of straight to DVD hell, the latest being this muddled and labourous thriller, which might have been okay had he not taken other acclaimed and promising new talent stars like Derek Jacobi, Julie Cox, Vanessa Redgrave, Jason Flemyng and Mel Smith along with him. What caused him to fall from the dizzying heights of success so quickly (apart from maybe being a one trick pony) is anyone's guess (a dodgy personal life being a possible guess) but here he is.<br /><br />A script as far fetched and incomprehensible as this would have been a task in anyone's hand, but with a miscast looking Jones in the lead, it's even more of a task to fathom. Jacobi's juxtaposing roles as a former thesp tramp and Dickens himself talking directly to the camera through-out are obviously hints building up to something and the script is predictable in other areas too. Add to this cheap looking production values through out and debut director (also writer) Brendan Foley has made a bad first impression.<br /><br />What exactly did I expect with something that came free with The Daily Mail? *,negative
"Ludicrous. Angelic 9-year-old Annakin turns into whiny brat 19-year-old Annakin, who somehow seems appealing to Amidala, 5 years his senior. Now 22-year-old Jedi warrior hero Annakin has a couple of bad dreams, and so takes to slaughtering children, his friends, and the entire framework of his existence because a crazy old man convinced him a) his precious wife might really die, and b) only he can prevent this. Ludicrosity squared.<br /><br />I think the people who like this movie are not paying attention. The story is ridiculous. The characters are unbelievable (literally, not the perverted sense of ""fantastic"", ""wonderful"", etc.).<br /><br />Obi-wan Kenobi was the wise and kind anchor for the entire series, but in the climax, he hacks off Annakin's legs, lets him burn in the lava, and leaves him to suffer. Doesn't anyone think that's a little out of character? Not to mention it was pretty stupid to take a chance on him living, as it turns out.<br /><br />I was expecting at least a story that showed consistent characters with plausible motivations. None of that here. The story could have been written by a 10 year old.<br /><br />Oh yeah, the CGI is pretty cool.,negative"
This is one of my all time favorite cheap, corny, vampire B movies. <br /><br />Calvin Klein underwear model...oh, I mean, Stefan the Good Vampire, returns to Transylvania to ascend the throne of Vampiric Royalty, but Manicure-impaired and eternally drooling half brother Radu has other plans. Having killed their father the Vampire King, Radu now sets his sights on Stefan, Stefan's new mortal girlfriend Michelle and her two pretty friends, and the all-powerful Bloodstone.<br /><br />Okay, the scenery is beautiful, and it should be as it was shot on location in Transyl-fricken-vania for gosh sakes. The actresses are no great shakes and Stefan the Heroic Vampire is about as charming as a refrigerated fireplace poker, but who cares? There's only one reason to watch this movie, and his name is RADU! He's a physical homage to Nosferatu and he has the best lines in the movie, all spoken in the raspy voice of a man who smokes ten packs of cigarettes a day. The cemetery festival scene is one of the best scenes in the film, as Radu slowly approaches the camera and reveals his grinning, slobbering face for the world to see. I found myself cheering him on as he collected victims and taunted his perfect brother. But maybe I'm just a sicko. Questionable taste in men aside, I highly recommend this film to vampire enthusiasts. It's original, it's fun, and Radu is one of the best vampires I've seen in a long time...much more fun than the stiff, tragic, whining Undead brats that endlessly grace the horror screens these days. Radu enjoys his sadism and never apologizes. He's what a vampire should be.,positive
"I managed to record THE DION BROTHERS, off broadcast TV, (with the commercials), back in the early 80s. I've loaned it to many friends, all of whom agree it's one of the best B ""bandit"" movies ever made. One day, while walking to my NYC apartment, I saw Stacy Keach shooting a scene for his TV series, Mickey Spilane. We had a moment to chat, and I told him how much I enjoyed THE DION BROS, and considered it a pure classic. He thanked me, and said it was one of the best, and most memorable film experiences of his career. He was very friendly, and sincere, and I was grateful for the few moments he took to chat with a fan. This is one classic that needs to be on DVD.,positive"
"This film has little to recommend it, though that little being the breathtaking scenery, cinematography and direction of wildlife, it is difficult to bring up its weak points in the company of such rave reviews. It is precisely these things, however, that make the lack of a satisfactory plot and its execution so disappointing. <br /><br />I watched this with my children and none of us was too impressed by the end. Yes, the pictures were great, the broad landscapes across the forest and mountains magnificent, but what was going on in the foreground? The rather dull narration of the stupidity of an insipid girl who learns all too slowly a very basic lesson about befriending wildlife - and gets off quite easily given the track record of that sort of thing. It is certainly not a new story, in fact there is nothing remotely novel about the way it is told, and we have all seen this before, and, indeed, much more eloquently by Antoine de Saint-Exupéry.<br /><br />The only thing really to be gleaned from this film is a sense of how to work with these wonderful lenses and forest lighting; the rest is a waste of time.,negative"
"Yes, I know that this movie is meant as a comedy! And the humor is over the top! But the theme about people getting less intelligent in future time might not be so far fetched! I cannot say that it will happen,but if we don't take proper care of our educational system than this could be a possibility! I have noticed that some schools aren't teaching facts anymore! (Like history,geography,basic stuff). The focus is more on learning practical abilities! The theory behind most subjects may be boring but is essential in understanding how things work! In the movie there is this ridiculous example of people growing crops with Gatorade in stead of water! Well,we can laugh about it! But if you never been taught that water contains minerals necessary for plants to grow so how would you know! To me this is a scary notion! So now you understand why this subject isn't funny anymore! It could be that Mike Judge is making fun but at the same time is warning people for a real disaster if education doesn't improve fast! Am I taking this movie too seriously! Yes of course! To each his own fun! I loved Mike Judge's work (Beavis and Butthead and Office space)! In these he was able to be critical and funny at the same time! In ""Idiocracy"" I missed this! Most of the events are too absurd and as I said earlier very scary! I do think if you are in the mood you will like this movie!,positive"
Jimmy Stewart brings the story of Charles Lindbergh to life as he almost narrates the entire film while he crosses the Atlantic. It well edited with flashbacks over Lindeberghs life. Franz Waxman score is shear brilliant and truly gives the picture a heroic feel. One of Stewarts finest roles and this film can deliver time after time. Look for appearances by Murray Hamilton ( The Mayor in the JAWS Movie) as Bud Gurney.Comes out on DVD 8-15-06 with the release of a few more of Stewarts classic films. I consider Jimmy Stewart to be Americas greatest Actor and never tire of seeing him in any film I see, watch this picture and you'll agree.,positive
"Phantasm ....Class. Phantasm II.....awesome. Phantasm III.....erm.....terrible.<br /><br />Even though i would love to stick up for this film, i quite simply can't. The movie seems to have ""sold out"". First bad signs come when the video has trailers for other films at the start (something the others did not). Also too many pointless characters, prime examples the kid (who is a crack shot, funny initially but soon you want him dead), the woman who uses karate to fight off the balls (erm not gonna work, or rather shouldn't) and the blooming zombies (what the hell are they doing there, there no link to them in the other Phatasms). Also there is a severe lack of midgets running about.<br /><br />The only good bits are the cracking start and, of course, Reggie B.<br /><br />(Possible SPOILER coming Up)<br /><br />To me this film seems like a filler between II and IV as extra characters just leave at the end so can continue with main 4 in IV.<br /><br />Overall very, VERY disappointing. 3 / 10,negative"
"Where to start?? I think only three other films have led me to post a review on IMDb, and all of those were positive. As for this..?<br /><br />Mind-blowingly, hideously, tragically, embarrassingly, catastrophically, stupidly, irritatingly, completely and utterly beyond awful.<br /><br />I am STUNNED this got made, never mind given a theatrical release. I think I am literally in shock.<br /><br />I'm no ""snob"". I didn't expect beautiful film-making or intense character-depth, but this is truly beyond a joke. We simply MUST demand more from the films we see.<br /><br />Avoid. Like the Black Death.,negative"
What can I say? I couldn't sleep and I came across this movie on MTV. I started watching it with every intention of changing the channel if it started to get lame as so many anti-drug movies do but I got sucked into this movie and I couldn't stop watching. Nick Stahl did an amazing job with his character, and in my opinion he really made the movie something worth watching. I was interested in purchasing the soundtrack to the movie (or even the movie itself) and MTV.com was no help at all, but believe it or not Amazon.com is taking pre-orders for the August 5th release of the movie on DVD. I know I had a hard time tracking it down, and I'm sure other people might have had the same problem. I'm buying my own copy so I can drool over Nick Stahl while bawling my eyes out at the same time thanks to the emotional storyline!,positive
How many of us wish that we could throw away social and cultural obligations and be free? Most of us, I suspect. Shall we dance? is not a movie about dancing. It is about learning about ourselves, recognising what we are looking for in life and having the courage to go in search of it. Mr Sugiyama is a middle-aged member of a Japanese society where ballroom dancing is viewed as unsuitable behaviour. <br /><br />One day Mr Sugiyama sees a beautiful girl leaning out of the window of a dancing acadamy. he is fascinated by her and eventually signs up for dancing lessons. He is ashamed of his dancing and afraid of ridicule. He hides the fact that he is attending dancing classes from his colleagues and family.<br /><br />There is a hilarious scene in the mensroom at the office when Sugiyama and Watanabe, a workmate who also dances, are interrupted practising some dance steps. There are many other funny and warm-hearted scenes.<br /><br />The ending is not a fairytale, but it leaves the viewer feeling good.<br /><br />This movie helped me to understand the Japanese people a little better. It is a warm and very worthwhile film to see.,positive
I sat through almost one episode of this series and just couldn't take anymore. It felt as though I'd watched dozens of episodes already, and then it hit me.....There's nothing new here! I've heard that joke on Seinfeld, I saw someone fall like that on friends, an episode of Happy Days had almost the same storyline, ect. None of the actors are interesting here either! Some were good on other shows (not here), and others are new to a profession they should have never entered. Avoid this stinker!,negative
My mom took me to see this movie when it came out around Christmas of 1976. I loved it then and I love it now. I know everyone makes fun of Barbra's hair in this one, but I think she looks and sounds great! ...And I seem to remember a number of women who copied that permed look at the time! Also, the bath tub scene between Streisand and Kristoferson is just so sexy! The music is great as well. This is the groovy 70's Babs at her best!,positive
So well done. The photography, sound, music and the performances were the best. It's also an amusing story line that brings a smile to your face with each scene--I loved it and I'm a 60 year old heterosexual guy. Each character seemed to fit their part to a tee. It's the best performance that I've seen from Ms. Capshaw--she's been in more movies than I thought, but this was a wonderful achievement. I suppose it's a plus to have Spielberg money behind you allowing for a fat budget and all the best that money can buy technically. Two of the cast have successful T.V. shows of their own now--it's easy to see why. Tom Selleck does his usual good job.,positive
Lame B-horror that takes itself too damn seriously considering its subject matter concerns an aging old dear who has been turned into a creature of the night by a lodger who has come to rent a room from her. When said lodger is killed off, Mom has to go out to feed on her own and that causes some family strain and also garners some attention from the authorities.<br /><br />My main complaint is that this film should have brought THE FUNNY. It failed to do so although it did have some mild gore and schlocky creature makeup effects to keep the B-movie crowd happy. I've seen worse but I wouldn't give this one a rec--4.5/10.,negative
"""Terror in the Aisles"" might look like the ultimate treat for horror fans but it has, in fact, very few to offer. Granted, it presents a decent and versatile (too versatile?) selection of horror/thriller fragments that are considered classic but ...what's the point? This documentary primarily aims for the horror-loving public so we've pretty much seen all these clips already, haven't we? The only thing really praiseworthy about this project is the editing. If you're into scream-queens, chases by vile murderers and that sort of things, ""Terror in the Aisles"" has some neat compilations of the most famous sequences. All these different scenes hang together by a lame wraparound story starring Donald Pleasance and Nancy Allen sitting in a movie theater. In between two sequences, the address the viewer and ""explain"" why we love horror so much. Those speeches naturally are soporific and rather obvious (it's in our nature to be afraid ...bla bla bla) and I fail to understand why many people love the concept. This is worth a peek in case you're a loyal horror fan but it certainly isn't essential viewing. On the contrary: in case you still have to see a classic genre title, beware that bits and pieces of it here don't spoil your future viewing. The main reason why I overall disliked it is because it shamelessly ignores a lot of lesser known, but fundamental (foreign) titles endlessly focusing on ""Halloween"". This does result in a cool inside joke, however, when Donald Pleasance screams to the screen at his own character.,negative"
"I have always been a huge fan of ""Homicide: Life On The Street"" so when I heard there was a reunion movie coming up, I couldn't wait.<br /><br />Let me just say, I was not disappointed at all. It was one of the most powerful 2 hours of television I've ever seen. It was great to see everyone back again, but the biggest pleasure of all was to have Andre Braugher back, because the relationship between Pembleton and Bayliss was always the strongest part of an all-together great show.,positive"
I was stunned by this film. Afterwards, I didn't even want to see any films for a long time- any other film would be so unsatisfying by comparison.<br /><br />For many, it may be the worst of Antonioni- very slow, without an engaging conventional story line, microscopic examinations of human emotions and interactions- and the worst of Wenders- verbose, confused transcendentalism. It is composed of short distinct episodes linked by Wenders' typical meandering hero's stream of consciousness, so it doesn't produce the temporary oblivion of escapist cinema.<br /><br />But for fans, the worst is the best and the disjointed story line is sketching a single poetic image that stretches across the film. Wenders and Antonioni create a discourse between their segments that seeks out the heart of things.<br /><br />,positive
**Might contain spoilers**<br /><br />Ok, lets conclude this movie in one word: bad. Two words? Really bad. Now why do I think that? Let me explain. <br /><br />Guttenberg leads a special-ops team consisting of four persons that get assigned to retake an lethal virus after some arms-dealer stole it from a lab. They do this by attacking the arm-dealers in mid-flight and somehow gets back the virus after some fighting. However, suspicions arise about Guttenberg because one of the terrorist knew his name. After debriefing the team-members get attacked by unknown persons and everyone starts to suspect everyone else is involved. After deciding they cant trust their bosses, they decide to, once again, steal the virus and try to lure out the possible attackers.<br /><br />In theory this is a plot that could have worked in a low-budget movie that just aims to be aired on TV. However, the plot is compromised and the movie ruined in several accounts. Firstly, the plot is totally predictable and it is not fun to know how the movie is going to end after three minutes. Second. The acting is really bad, or the actors are directed to act as dummys. There aren't many emotions, change of facial expressions at all etc. I was especially disappointed in Guttenberg that I believe can do so much more, but fails completely in an attempt to be a rough action-hero. In addition, though I am not by any means any expert on the subject, I totally believe I could assemble a better covert-ops team by picking up five strangers and train them for a week. This seems to be a theme in the movie to do things as stupid and unprofessionally as possible. This go for good guys, bad guys and bystanders as well. Then I sincerely doubt the scientific and technical consultants, if any, of the film. For example, I have poured liquid nitrogen over my hand and I didn't break instantly.<br /><br />Don't know how to conclude this really, but lets say that this movie has a predictable plot, bad acting and they seem to be amateurs in whatever the do. Sorry, can't be any nicer than that. Do not watch this movie, it is not even so bad it is funny. 2/10,negative
Family problems abound in real life and that is what this movie is about. Love can hold the members together through out the ordeals and trials and that is what this movie is about. One man, Daddy, has the maturity and fortitude to sustain the family in the face of adversity. The kids grow up,one all be it, in the hard way, to realize that no matter how old they or a parent is, the parent still loves their children and are willing to provide them a cushion when they fall. ALL the actors portraying their characters did outstanding performances. Yes, I shed a tear along the way knowing I had had similar experiences both as a young adult and later as a parent. This true to life is one which every young adult, and parent, would do well to see, although some will not realize it until they too are parents. A must see for those who care about their families.,positive
"What was an exciting and fairly original series by Fox has degraded down to meandering tripe. During the first season, Dark Angel was on my weekly ""must see"" list, and not just because of Jessica Alba.<br /><br />Unfortunately, the powers-that-be over at Fox decided that they needed to ""fine-tune"" the plotline. Within 3 episodes of the season opener, they had totally lost me as a viewer (not even to see Jessica Alba!). I found the new characters that were added in the second season to be too ridiculous and amateurish. The new plotlines were stretching the continuity and credibility of the show too thin. On one of the second season episodes, they even had Max sleeping and dreaming - where the first season stated she biologically couldn't sleep.<br /><br />The moral of the story (the one that Hollywood never gets): If it works, don't screw with it!<br /><br />azjazz,negative"
"This was just telecast here in the U.S. Others have commented on the faithfulness (or lack of same) to the novel; the 1983 BBC version is far superior on this and all other counts. Given the scope of the novel, it should not have been condensed to 85 minutes. Key sections have to be rushed or alluded to, or omitted; there barely enough time just to get in the chronology of events, so character development has to be sacrificed: we cannot get much of a sense of who the people are, which robs us of what makes Austen so great.<br /><br />One major negative for me was the cinematography, which I thought was just awful, and quite literally sickening. The camera is constantly doing ultra-closeups, and swirling around and around in circles. Maybe on a small TV box this is OK, but on our 40"" hi-def screen it was so literally dizzying that both my wife and I had to look away from the set repeatedly (my Dramamine supply had run out). Of course, this did distract from the rather lackluster I'm-just-reading-what's-in-the-script acting (isolated scenes are nicely done, but not enough to save things).<br /><br />Adding up the score so far in the Complete J.A. Sweepstakes: I'd rate ""Northanger Abbey"" a success, because of superior direction and production values (and the story lends itself better to short treatment), ""Persuasion"" OK (though not the equal of other versions, with condensation again being at fault), both far ahead of this attempt. I will hope for better in the two remaining novels in this TV Reader's Digest Jane Austen; like others, I am thankful they left P & P alone!,negative"
